,show_id,type,title,director,cast,country,date_added,release_year,rating,duration,listed_in,description,year_added,month_added
1,s2,TV Show,Blood & Water,Unknown,"Ama Qamata, Khosi Ngema, Gail Mabalane, Thabang Molaba, Dillon Windvogel, Natasha Thahane, Arno Greeff, Xolile Tshabalala, Getmore Sithole, Cindy Mahlangu, Ryle De Morny, Greteli Fincham, Sello Maake Ka-Ncube, Odwa Gwanya, Mekaila Mathys, Sandi Schultz, Duane Williams, Shamilla Miller, Patrick Mofokeng",South Africa,2021-09-24,2021,TV-MA,2 Seasons,"International TV Shows, TV Dramas, TV Mysteries","After crossing paths at a party, a Cape Town teen sets out to prove whether a private-school swimming star is her sister who was abducted at birth.",2021,9
4,s5,TV Show,Kota Factory,Unknown,"Mayur More, Jitendra Kumar, Ranjan Raj, Alam Khan, Ahsaas Channa, Revathi Pillai, Urvi Singh, Arun Kumar",India,2021-09-24,2021,TV-MA,2 Seasons,"International TV Shows, Romantic TV Shows, TV Comedies","In a city of coaching centers known to train India’s finest collegiate minds, an earnest but unexceptional student and his friends navigate campus life.",2021,9
15,s16,TV Show,Dear White People,Unknown,"Logan Browning, Brandon P. Bell, DeRon Horton, Antoinette Robertson, John Patrick Amedori, Ashley Blaine Featherson, Marque Richardson, Giancarlo Esposito",United States,2021-09-22,2021,TV-MA,4 Seasons,"TV Comedies, TV Dramas","Students of color navigate the daily slights and slippery politics of life at an Ivy League college that's not nearly as ""post-racial"" as it thinks.",2021,9
17,s18,TV Show,Falsa identidad,Unknown,"Luis Ernesto Franco, Camila Sodi, Sergio Goyri, Samadhi Zendejas, Eduardo Yáñez, Sonya Smith, Alejandro Camacho, Azela Robinson, Uriel del Toro, Géraldine Bazán, Gabriela Roel, Marcus Ornellas",Mexico,2021-09-22,2020,TV-MA,2 Seasons,"Crime TV Shows, Spanish-Language TV Shows, TV Dramas",Strangers Diego and Isabel flee their home in Mexico and pretend to be a married couple to escape his drug-dealing enemies and her abusive husband.,2021,9
21,s22,TV Show,Resurrection: Ertugrul,Unknown,"Engin Altan Düzyatan, Serdar Gökhan, Hülya Darcan, Kaan Taşaner, Esra Bilgiç, Osman Soykut, Serdar Deniz, Cengiz Coşkun, Reshad Strik, Hande Subaşı",Turkey,2021-09-22,2018,TV-14,5 Seasons,"International TV Shows, TV Action & Adventure, TV Dramas","When a good deed unwittingly endangers his clan, a 13th-century Turkish warrior agrees to fight a sultan's enemies in exchange for new tribal land.",2021,9
25,s26,TV Show,Love on the Spectrum,Unknown,Brooke Satchwell,Australia,2021-09-21,2021,TV-14,2 Seasons,"Docuseries, International TV Shows, Reality TV","Finding love can be hard for anyone. For young adults on the autism spectrum, exploring the unpredictable world of dating is even more complicated.",2021,9
32,s33,TV Show,Sex Education,Unknown,"Asa Butterfield, Gillian Anderson, Ncuti Gatwa, Emma Mackey, Connor Swindells, Kedar Williams-Stirling, Alistair Petrie",United Kingdom,2021-09-17,2020,TV-MA,3 Seasons,"British TV Shows, International TV Shows, TV Comedies","Insecure Otis has all the answers when it comes to sex advice, thanks to his therapist mom. So rebel Maeve proposes a school sex-therapy clinic.",2021,9
37,s38,TV Show,Angry Birds,Unknown,"Antti Pääkkönen, Heljä Heikkinen, Lynne Guaglione, Pasi Ruohonen, Rauno Ahonen",Finland,2021-09-16,2018,TV-Y7,1 Season,"Kids' TV, TV Comedies","Birds Red, Chuck and their feathered friends have lots of adventures while guarding eggs in their nest that pesky pigs keep trying to steal.",2021,9
39,s40,TV Show,Chhota Bheem,Unknown,"Vatsal Dubey, Julie Tejwani, Rupa Bhimani, Jigna Bhardwaj, Rajesh Kava, Mousam, Swapnil",India,2021-09-16,2021,TV-Y7,3 Seasons,Kids' TV,"A brave, energetic little boy with superhuman powers leads his friends on exciting adventures to guard their fellow Dholakpur villagers from evil.",2021,9
40,s41,TV Show,He-Man and the Masters of the Universe,Unknown,"Yuri Lowenthal, Kimberly Brooks, Antony Del Rio, Trevor Devall, Ben Diskin, Grey Griffin, David Kaye, Tom Kenny, Judy Alice Lee, Roger Craig Smith, Fred Tatasciore",United States,2021-09-16,2021,TV-Y7,1 Season,"Kids' TV, TV Sci-Fi & Fantasy",Mighty teen Adam and his heroic squad of misfits discover the legendary power of Grayskull — and their destiny to defend Eternia from sinister Skeletor.,2021,9
49,s50,TV Show,Castle and Castle,Unknown,"Richard Mofe-Damijo, Dakore Akande, Bimbo Manuel, Blossom Chukwujekwu, Deyemi Okanlawon, Etim Effiong, Denola Grey, Duke Akintola, Eku Edewor, Ade Laoye, Anee Icha, Kevin Ushi, Jude Chukwuka, Amanda Afolabi",Nigeria,2021-09-15,2021,TV-MA,2 Seasons,"International TV Shows, TV Dramas","A pair of high-powered, successful lawyers find themselves defending opposite interests of the justice system, causing a strain on their happy marriage.",2021,9
50,s51,TV Show,Dharmakshetra,Unknown,"Kashmira Irani, Chandan Anand, Dinesh Mehta, Ankit Arora, Pushkar Goggiaa, Anjali Rana, Aarya DharmChand Kumar, Amit Behl, Maleeka Ghai",India,2021-09-15,2014,TV-PG,1 Season,"International TV Shows, TV Dramas, TV Sci-Fi & Fantasy","After the ancient Great War, the god Chitragupta oversees a trial to determine who were the battle's true heroes and villains.",2021,9
55,s56,TV Show,Nailed It,Unknown,"Nicole Byer, Jacques Torres",United States,2021-09-15,2021,TV-PG,6 Seasons,Reality TV,"Home bakers with a terrible track record take a crack at re-creating edible masterpieces for a $10,000 prize. It's part reality contest, part hot mess.",2021,9
65,s66,TV Show,Numberblocks,Unknown,"Beth Chalmers, David Holt, Marcel McCalla, Teresa Gallagher",United Kingdom,2021-09-15,2021,TV-Y,6 Seasons,Kids' TV,"In a place called Numberland, math adds up to tons of fun when a group of cheerful blocks work, play and sing together.",2021,9
67,s68,TV Show,Saved by the Bell,Unknown,"Mark-Paul Gosselaar, Tiffani Thiessen, Mario Lopez, Lark Voorhies, Elizabeth Berkley, Dustin Diamond, Dennis Haskins",United States,2021-09-15,1994,TV-PG,9 Seasons,"Kids' TV, TV Comedies","From middle school to college, best friends Zack, Kelly, Slater, Jessie, Screech and Lisa take on the highs and lows of life together in this hit series.",2021,9
72,s73,TV Show,Jack Whitehall: Travels with My Father,Unknown,"Jack Whitehall, Michael Whitehall",United Kingdom,2021-09-14,2021,TV-MA,5 Seasons,"British TV Shows, Docuseries, International TV Shows","Jovial comic Jack Whitehall invites his stuffy father, Michael, to travel with him through Southeast Asia in an attempt to strengthen their bond.",2021,9
76,s77,TV Show,Yowamushi Pedal,Unknown,"Daiki Yamashita, Kohsuke Toriumi, Jun Fukushima, Hiroki Yasumoto, Showtaro Morikubo, Kentaro Ito, Daisuke Kishio, Yoshitsugu Matsuoka, Junichi Suwabe, Ayaka Suwa, Megumi Han, Tomoaki Maeno, Tsubasa Yonaga, Tetsuya Kakihara, Satoshi Hino, Hiroyuki Yoshino, Atsushi Abe, Koji Yusa, Kouki Miyata, Hiro Shimono, Wataru Hatano, Yuichi Nakamura, Kenji Nojima, Mamoru Miyano, Daisuke Ono, Yuma Uchida, Jun Fukuyama",Japan,2021-09-14,2013,TV-14,1 Season,"Anime Series, International TV Shows","A timid, anime-loving teen gets drawn into a school cycling club, where his new friends help him face tough challenges to develop his racing talent.",2021,9
82,s83,TV Show,Lucifer,Unknown,"Tom Ellis, Lauren German, Kevin Alejandro, D.B. Woodside, Lesley-Ann Brandt, Scarlett Estevez, Rachael Harris, Aimee Garcia, Tricia Helfer, Tom Welling, Jeremiah W. Birkett, Pej Vahdat, Michael Gladis",United States,2021-09-10,2021,TV-14,6 Seasons,"Crime TV Shows, TV Comedies, TV Dramas","Bored with being the Lord of Hell, the devil relocates to Los Angeles, where he opens a nightclub and forms a connection with a homicide detective.",2021,9
92,s93,TV Show,Into the Night,Unknown,"Pauline Etienne, Laurent Capelluto, Stefano Cassetti, Mehmet Kurtuluş, Babetida Sadjo, Jan Bijvoet, Ksawery Szlenkier, Vincent Londez, Regina Bikkinina, Alba Gaïa Kraghede Bellugi, Nabil Mallat",Belgium,2021-09-08,2021,TV-MA,2 Seasons,"International TV Shows, TV Dramas, TV Mysteries",Passengers and crew aboard a hijacked overnight flight scramble to outrace the sun as a mysterious cosmic event wreaks havoc on the world below.,2021,9
95,s96,TV Show,The Circle,Unknown,Michelle Buteau,"United States, United Kingdom",2021-09-08,2021,TV-MA,3 Seasons,Reality TV,"Status and strategy collide in this social experiment and competition show where online players flirt, befriend and catfish their way toward $100,000.",2021,9
97,s98,TV Show,Kid Cosmic,Unknown,"Jack Fisher, Tom Kenny, Amanda C. Miller, Kim Yarbrough, Keith Ferguson, Grey Griffin, Lily Rose Silver",United States,2021-09-07,2021,TV-Y7,2 Seasons,"Kids' TV, TV Comedies, TV Sci-Fi & Fantasy",A boy's superhero dreams come true when he finds five powerful cosmic stones. But saving the day is harder than he imagined — and he can't do it alone.,2021,9
98,s99,TV Show,Octonauts: Above & Beyond,Unknown,"Antonio Aakeel, Chipo Chung, Simon Foster, Teresa Gallagher, Simon Greenall, Kate Harbour, Paul Panting, Rob Rackstraw, William Vanderpuye, Helen Walsh, Keith Wickham, Andres Williams, Jo Wyatt",United Kingdom,2021-09-07,2021,TV-Y,1 Season,"British TV Shows, Kids' TV","The Octonauts expand their exploration beyond the sea — and onto land! With new rides and new friends, they'll protect any habitats and animals at risk.",2021,9
99,s100,TV Show,On the Verge,Unknown,"Julie Delpy, Elisabeth Shue, Sarah Jones, Alexia Landeau, Mathieu Demy, Troy Garity, Timm Sharp, Giovanni Ribisi","France, United States",2021-09-07,2021,TV-MA,1 Season,"TV Comedies, TV Dramas","Four women — a chef, a single mom, an heiress and a job seeker — dig into love and work, with a generous side of midlife crises, in pre-pandemic LA.",2021,9
104,s105,TV Show,Tayo the Little Bus,Unknown,"Robyn Slade, Kami Desilets",South Korea,2021-09-06,2016,TV-Y,2 Seasons,"Kids' TV, Korean TV Shows","As they learn their routes around the busy city, Tayo and his little bus friends discover new sights and go on exciting adventures every day.",2021,9
106,s107,TV Show,Bunk'd,Unknown,"Peyton List, Karan Brar, Skai Jackson, Miranda May, Kevin G. Quinn, Nathan Arenas, Nina Lu",United States,2021-09-05,2021,TV-G,5 Seasons,"Kids' TV, TV Comedies","The Ross siblings of Disney's hit series ""Jessie"" spend a summer full of fun and adventure at Maine's Camp Kikiwaka, where their parents first met.",2021,9
108,s109,TV Show,Dive Club,Unknown,"Aubri Ibrag, Sana'a Shaik, Miah Madden, Mercy Cornwall, Georgia-May Davis, Ryan Harrison, Josh Heuston, Alexander Grant",Australia,2021-09-03,2021,TV-G,1 Season,"Kids' TV, TV Dramas, Teen TV Shows","On the shores of Cape Mercy, a skillful group of teen divers investigate a series of secrets and signs after one of their own mysteriously goes missing.",2021,9
109,s110,TV Show,La casa de papel,Unknown,"Úrsula Corberó, Itziar Ituño, Álvaro Morte, Paco Tous, Enrique Arce, Pedro Alonso, María Pedraza, Alba Flores, Miguel Herrán, Jaime Lorente, Esther Acebo, Darko Peric, Kiti Mánver",Spain,2021-09-03,2021,TV-MA,5 Seasons,"Crime TV Shows, International TV Shows, Spanish-Language TV Shows",Eight thieves take hostages and lock themselves in the Royal Mint of Spain as a criminal mastermind manipulates the police to carry out his plan.,2021,9
111,s112,TV Show,Sharkdog,Unknown,"Liam Mitchell, Dee Bradley Baker, Grey Griffin, Josh McDermitt, Kari Wahlgren, Judy Alice Lee, Ali Mawji","United States, Singapore",2021-09-03,2021,TV-Y,1 Season,Kids' TV,"Half shark, half dog with a big heart and a belly full of fish sticks! Together, Sharkdog and his human pal Max can take on any silly or messy adventure.",2021,9
120,s121,TV Show,Heroes of Goo Jit Zu,Unknown,"Jon Allen, Kellen Goff, Joe Hernandez, Kaiji Tang",Australia,2021-09-02,2021,TV-Y7,1 Season,"Kids' TV, TV Comedies","After a meteor crash, a group of zoo animals transforms into squishy, gooey and stretchy superheroes with special powers and soon takes on evildoers.",2021,9
125,s126,TV Show,Q-Force,Unknown,"Sean Hayes, Wanda Sykes, Laurie Metcalf, David Harbour, Gary Cole, Patti Harrison, Matt Rogers",United States,2021-09-02,2021,TV-MA,1 Season,"Crime TV Shows, TV Action & Adventure, TV Comedies","A gay superspy and his scrappy LGBTQ squad fight to prove themselves to the agency that underestimated them. Today, West Hollywood… tomorrow, the world!",2021,9
153,s154,TV Show,Kid-E-Cats,Unknown,"Lori Gardner, Kate Bristol, Billy Bob Thompson, Marc Thompson, Erica Schroeder",Russia,2021-09-01,2016,TV-Y,2 Seasons,Kids' TV,"Cookie, Pudding and Candy are kitten siblings whose favorite things are sweet treats and letting their curiosity lead them on adventures in learning.",2021,9
154,s155,TV Show,Kuroko's Basketball,Unknown,"Kensho Ono, Yuki Ono, Chiwa Saito, Yoshimasa Hosoya, Hirofumi Nojima, Kenji Hamada, Takuya Eguchi, Soichiro Hoshi, Tatsuhisa Suzuki, Go Inoue, Daisuke Ono, Ryohei Kimura, Junichi Suwabe, Kazuya Nakai, Fumiko Orikasa, Kenichi Suzumura, Kisho Taniyama, Hiroshi Kamiya",Japan,2021-09-01,2015,TV-MA,3 Seasons,"Anime Series, International TV Shows, Teen TV Shows","Five middle school basketball stars went to separate high schools, and now Tetsuya Kuroko and Seirin High are making their play for glory.",2021,9
160,s161,TV Show,Major Dad,Unknown,"Gerald McRaney, Shanna Reed, Nicole Dubuc, Chelsea Hertford, Marisa Ryan, Matt Mulhern, Beverly Archer, Jon Cypher",United States,2021-09-01,1992,TV-PG,4 Seasons,TV Comedies,"When he marries a journalist and becomes stepdad to her daughters, a U.S. Marine finds his once-orderly life no longer entirely under his command.",2021,9
184,s185,TV Show,Sparking Joy,Unknown,Marie Kondo,United States,2021-08-31,2021,TV-PG,1 Season,Reality TV,"In this reality series, Marie Kondo brings her joyful tidying tactics to people struggling to balance work and home life — and shares her own world.",2021,8
193,s194,TV Show,D.P.,Unknown,"Jung Hae-in, Koo Kyo-hwan, Kim Sung-kyun, Son Suk-ku",", South Korea",2021-08-27,2021,TV-MA,1 Season,"International TV Shows, TV Dramas",A young private’s assignment to capture army deserters reveals the painful reality endured by each enlistee during his compulsory call of duty.,2021,8
212,s213,TV Show,Rebellion,Unknown,"Charlie Murphy, Ruth Bradley, Sarah Greene, Brian Gleeson, Michelle Fairley, Ian McElhinney, Michael Ford-FitzGerald, Paul Reid, Barry Ward, Tom Turner, Perdita Weeks, Andrew Simpson, Sophie Robinson",Ireland,2021-08-27,2016,TV-MA,2 Seasons,"International TV Shows, TV Dramas","As World War I rages, three women and their families in Dublin choose sides in the violent Easter Rising revolt against British rule.",2021,8
219,s220,TV Show,EDENS ZERO,Unknown,"Takuma Terashima, Mikako Komatsu, Rie Kugimiya, Hiromichi Tezuka, Shiori Izawa, Shiki Aoki, Sayaka Ohara, Hochu Otsuka, Kikuko Inoue",Japan,2021-08-26,2021,TV-14,1 Season,"Anime Series, International TV Shows","Aboard the Edens Zero, a lonely boy with the ability to control gravity embarks on an adventure to meet the fabled space goddess known as Mother.",2021,8
220,s221,TV Show,Family Reunion,Unknown,"Loretta Devine, Tia Mowry-Hardrict, Anthony Alabi, Talia Jackson, Isaiah Russell-Bailey, Cameron J. Wright, Jordyn Raya James, Richard Roundtree",United States,2021-08-26,2021,TV-PG,4 Seasons,"Kids' TV, TV Comedies","When the McKellan family moves from Seattle to small-town Georgia, life down South – and traditional grandparents – challenge their big-city ways.",2021,8
232,s233,TV Show,Wheel of Fortune,Unknown,"Pat Sajak, Vanna White",United States,2021-08-25,2019,TV-G,3 Seasons,Reality TV,"Pat Sajak and Vanna White host one of TV's most popular, long-running game shows, where players spin a wheel for prizes and solve mystery phrases.",2021,8
241,s242,TV Show,Manifest,Unknown,"Melissa Roxburgh, Josh Dallas, Athena Karkanis, J.R. Ramirez, Luna Blaise, Jack Messina, Parveen Kaur",United States,2021-08-21,2021,TV-14,3 Seasons,"TV Dramas, TV Mysteries, TV Sci-Fi & Fantasy","When a plane mysteriously lands years after takeoff, the people onboard return to a world that has moved on without them and face strange, new realities.",2021,8
254,s255,TV Show,Go! Go! Cory Carson,Unknown,"Alan C. Lim, Paul Killam, Maisie Benson, Kerry Gudjohnsen, Smith Foreman, Neena-Sinaii Simpo, Eli Morse, Adelaide Hirasaki, Jim Capobianco, Anna Chambers, Pfifer Chastain",United States,2021-08-18,2021,TV-Y,5 Seasons,Kids' TV,"Beep, beep – go, go! Buckle up for fun and adventure with adorable kid car Cory Carson as he explores the winding roads of Bumperton Hills.",2021,8
265,s266,TV Show,Rascal Does Not Dream of Bunny Girl Senpai,Unknown,"Kaito Ishikawa, Asami Seto, Nao Toyama, Atsumi Tanezaki, Maaya Uchida, Yurika Kubo, Inori Minase",Japan,2021-08-15,2018,TV-14,1 Season,"Anime Series, International TV Shows, Romantic TV Shows","After experiencing ""puberty syndrome"" himself, high school pariah Sakuta keeps meeting girls suffering from it, including his sister and actor Mai.",2021,8
269,s270,TV Show,Winx Club,Unknown,"Liza Jacqueline, Helena Evangeliou, Lisa Ortiz, Kerry Williams, Gregory Abbey, Dan Green, Michael Sinterniklaas, Suzy Myers, Christina Rodriguez, Dani Schaffel, Sebastian Arcelus, Rachael Lillis",Italy,2021-08-15,2015,TV-Y7,2 Seasons,Kids' TV,"In this animated fantasy, a girl named Bloom befriends a band of fairies, then follows them into the secretive and dangerous ""Magical Dimension.""",2021,8
271,s272,TV Show,Brand New Cherry Flavor,Unknown,"Rosa Salazar, Eric Lange, Catherine Keener, Jeff Ward, Manny Jacinto, Hannah Levien, Patrick Fischler",United States,2021-08-13,2021,TV-MA,1 Season,"TV Dramas, TV Horror, TV Mysteries","A filmmaker heads to Hollywood in the early '90s to make her movie but tumbles down a hallucinatory rabbit hole of sex, magic, revenge — and kittens.",2021,8
272,s273,TV Show,Fast & Furious Spy Racers,Unknown,"Tyler Posey, Charlet Chung, Jorge Diaz, Camille Ramsey, Luke Youngblood, Renée Elise Goldsberry",United States,2021-08-13,2021,TV-Y7,5 Seasons,Kids' TV,A government agency recruits teen driver Tony Toretto and his thrill-seeking friends to infiltrate a criminal street racing circuit as undercover spies.,2021,8
274,s275,TV Show,Grace and Frankie,Unknown,"Jane Fonda, Lily Tomlin, Martin Sheen, Sam Waterston, June Diane Raphael, Brooklyn Decker, Ethan Embry, Baron Vaughn",United States,2021-08-13,2021,TV-MA,7 Seasons,"TV Comedies, TV Dramas","They’re not friends, but when their husbands leave them for each other, proper Grace and eccentric Frankie begin to bond in this Emmy-nominated series.",2021,8
275,s276,TV Show,The Kingdom,Unknown,"Chino Darín, Nancy Dupláa, Joaquín Furriel, Peter Lanzani, Mercedes Morán, Diego Peretti, Vera Spinetta, Nico García Hume, Victoria Almeida, Santiago Korovsky, Patricio Aramburu, Alfonso Tort, Diego Gentile, Néstor Guzzini, Daniel Kuzniecka",Argentina,2021-08-13,2021,TV-MA,1 Season,"Crime TV Shows, International TV Shows, Spanish-Language TV Shows","After his running mate's murder, a controversial televangelist becomes Argentina's presidential candidate. But nothing about him is as holy as he seems.",2021,8
277,s278,TV Show,AlRawabi School for Girls,Unknown,"Andria Tayeh, Rakeen Sa'ad, Noor Taher, Yara Mustafa, Joanna Arida, Salsabiela, Nadera Emran, Reem Saadeh",Jordan,2021-08-12,2021,TV-14,1 Season,"International TV Shows, TV Dramas, Teen TV Shows",The bullied outcasts at prestigious Al Rawabi School for Girls plot a series of risky takedowns to get back at their tormentors.,2021,8
286,s287,TV Show,Gabby's Dollhouse,Unknown,"Laila Lockhart Kraner, Tucker Chandler, Juliet Donenfeld, Maggi Lowe, Donovan Patton, Eduardo Franco, Tara Strong, Secunda Wood, Carla Tassara, Sainty Nelsen",United States,2021-08-10,2021,TV-Y,2 Seasons,Kids' TV,"Cute cats, quirky crafts and colorful magic! Join kitty enthusiast Gabby and her sidekick Pandy Paws as they team up for a series of animated adventures.",2021,8
288,s289,TV Show,Las muñecas de la mafia,Unknown,"Amparo Grisales, Fernando Solórzano, Angelica Blandon, Katherine Escobar, Yuly Ferreira, Alejandra Sandoval, Andrea Gómez, Andrea Guzmán, Diego Vásquez, Julián Román, Juan Pablo Franco",Colombia,2021-08-10,2018,TV-MA,1 Season,"Crime TV Shows, International TV Shows, Spanish-Language TV Shows","Based on the book ""Las Fantásticas,"" this exciting telenovela follows the tumultuous lives of five women who get mixed up with the Mafia.",2021,8
289,s290,TV Show,The Crowned Clown,Unknown,"Yeo Jin-goo, Lee Se-young, Kim Sang-kyung, Jung Hye-young, Jang Kwang, Kwon Hae-hyo, Jang Yeong-nam, Lee Kyu-han",South Korea,2021-08-10,2019,TV-14,1 Season,"International TV Shows, Romantic TV Shows, TV Dramas","Standing in for an unhinged Joseon king, a look-alike clown plays the part but increasingly becomes devoted to protecting the throne and the people.",2021,8
291,s292,TV Show,SHAMAN KING,Unknown,"Yoko Hikasa, Katsuyuki Konishi, Megumi Hayashibara, Inuko Inuyama, Romi Park, Kosuke Takaguchi, Masahiko Tanaka, Wataru Takagi, Yuji Ueda, Megumi Nakajima, Takehito Koyasu, Yoko Soumi, Motoko Kumai, Yui Horie, Yuichi Nakamura, Nana Mizuki, Takumu Miyazono, Noriaki Kanze, Michiko Neya, Toru Sakurai, Rina Hidaka, Masakazu Morita, Minami Takayama",Japan,2021-08-09,2021,TV-14,1 Season,"Anime Series, International TV Shows","Medium Yoh Asakura enters a battle tournament held every 500 years, competing with other shamans in a bid to become the all-powerful Shaman King.",2021,8
296,s297,TV Show,Hit & Run,Unknown,"Lior Raz, Kaelen Ohm, Sanaa Lathan, Moran Rosenblatt, Lior Ashkenazi, Gregg Henry, Gal Toren","Israel, United States",2021-08-06,2021,TV-MA,1 Season,"TV Action & Adventure, TV Dramas, TV Mysteries",A man searching for the truth behind his wife's death becomes caught up in a dangerous web of secrets and intrigue stretching from New York to Tel Aviv.,2021,8
311,s312,TV Show,Control Z,Unknown,"Ana Valeria Becerril, Michael Ronda, Yankel Stevan, Zion Moreno, Luis Curiel, Samantha Acuña, Macarena García, Fiona Palomo, Andrés Baida, Patricio Gallardo, Iván Aragón, Xabiani Ponce de León, Patricia Maqueo, Rodrigo Cachero, Rocío Verdejo, Mauro Sánchez Navarro, Lidia San José, Thanya López, Renata del Castillo, Arturo Barba, Kariam Castro, Ariana Saavedra, Alexander Holtmann, Nastassia Villasana, Marco Zunino",Mexico,2021-08-04,2021,TV-MA,2 Seasons,"International TV Shows, Spanish-Language TV Shows, TV Dramas","When a hacker begins releasing students' secrets to the entire high school, the socially isolated but observant Sofía works to uncover his/her identity.",2021,8
312,s313,TV Show,Cooking With Paris,Unknown,Paris Hilton,United States,2021-08-04,2021,TV-MA,1 Season,Reality TV,"With an anyone-can-cook attitude, Paris Hilton adds her own flair to every dish. Fun is just one edible glitter bomb away on this unique cooking show.",2021,8
313,s314,TV Show,Autumn's Concerto,Unknown,"Ady An, Vanness Wu, Ann Hsu, Wu Kang-ren, Xiao Xiao Bin",Taiwan,2021-08-03,2009,TV-14,1 Season,"International TV Shows, Romantic TV Shows, TV Dramas","After losing all memories of his past, a wealthy lawyer travels to a rural village where a woman he once loved now lives with her son.",2021,8
319,s320,TV Show,The Prince Who Turns into a Frog,Unknown,"Joe Chen, Ming Dao, Sam Wang, Joyce Chao, Gino, Su Li-hsin, Wang Chuan, Ehlo Huang",Taiwan,2021-08-03,2005,TV-14,1 Season,"International TV Shows, Romantic TV Shows, TV Comedies","Before his wedding, a cold CEO is hit by a car and awakens a changed man. As he and the driver fall in love, more changes appear on the road ahead.",2021,8
321,s322,TV Show,Two Fathers,Unknown,"Weber Yang, Lin Yo-Wei, Megan Lai, Amanda Chou, Lucia Xie, Cherry Leung",Taiwan,2021-08-03,2013,TV-14,1 Season,"International TV Shows, Romantic TV Shows, TV Comedies","When two single guys learn a woman they both slept with disappeared after giving birth, they decide to raise her baby girl together as a family.",2021,8
322,s323,TV Show,You're My Destiny,Unknown,"Joe Chen, Ethan Juan, Baron Chen, Bianca Bai, Na Wei-hsun, Tan Ai-Chen",Taiwan,2021-08-03,2008,TV-MA,1 Season,"International TV Shows, Romantic TV Shows, TV Comedies","A young woman's romantic cruise ends in a twist when she gets pregnant after a one-night stand with a rich executive, turning their lives upside down.",2021,8
323,s324,TV Show,30 Rock,Unknown,"Tina Fey, Alec Baldwin, Tracy Morgan, Jane Krakowski, Jack McBrayer, Scott Adsit, Judah Friedlander, Katrina Bowden, Keith Powell, Lonny Ross, John Lutz, Kevin Brown, Grizz Chapman, Maulik Pancholy",United States,2021-08-01,2012,TV-14,7 Seasons,TV Comedies,Liz Lemon juggles the demands of running an NBC sketch comedy show with trying to fix her disaster of a personal life and eating her night cheese.,2021,8
324,s325,TV Show,44 Cats,Unknown,"Sarah Natochenny, Suzy Myers, Simona Berman, Erica Schroeder, Marca Leigh, Scottie Ray, Henry F. Benjamin",Italy,2021-08-01,2020,TV-Y7,3 Seasons,Kids' TV,"Paw-esome tales abound when singing furry friends Lampo, Milady, Pilou and Meatball band together.",2021,8
338,s339,TV Show,Hunter X Hunter (2011),Unknown,"Megumi Han, Mariya Ise, Keiji Fujiwara, Miyuki Sawashiro, Daisuke Namikawa",Japan,2021-08-01,2014,TV-14,6 Seasons,"Anime Series, International TV Shows","To fulfill his dreams of becoming a legendary Hunter like his dad, a young boy must pass a rigorous examination and find his missing father.",2021,8
361,s362,TV Show,Charmed,Unknown,"Madeleine Mantock, Sarah Jeffery, Melonie Diaz, Rupert Evans, Ser'Darius Blain, Ellen Tamaki, Charlie Gillespie",United States,2021-07-31,2021,TV-14,3 Seasons,"TV Dramas, TV Sci-Fi & Fantasy","After their mother’s tragic death, a trio of sisters bond over their newfound powers, vanquish demons and band together to defend their magical legacy.",2021,7
