,show_id,type,title,director,cast,country,date_added,release_year,rating,duration,listed_in,description,year_added,month_added
2157,s2158,TV Show,Wizards: Tales of Arcadia,Unknown,"Colin O'Donoghue, David Bradley, Lena Headey, Emile Hirsch, Lexi Medrano, Steven Yeun, Alfred Molina, James Faulkner, Stephanie Beatriz, John Rhys-Davies",United States,2020-08-07,2020,TV-Y7,1 Season,"Kids' TV, TV Action & Adventure, TV Sci-Fi & Fantasy","Merlin’s apprentice joins Arcadia’s heroes on a time-bending adventure in Camelot, where conflict is brewing between the human, troll and magical worlds.",2020,8
2160,s2161,TV Show,Ever After High,Unknown,"Jonquil Goode, Karen Strassman, Audu Paden, Julie Maddalena, Marieve Herington, Rena Strober, Evan Smith, Wendee Lee, Haviland Stillwell, Valerie Arem, Cam Clarke, Colleen Foy, Cindy Robinson, Joe Sanfelippo, Jamieson Price, Debi Derryberry, Lindsey Ames, Rajo Zakic, Erin Fitzgerald, Malcolm Danare",Canada,2020-08-06,2016,TV-Y7,5 Seasons,Kids' TV,The kids of fairy-tale characters attend a school with two cliques: those who accept their fairy-tale destinies and those who want to write their own.,2020,8
2162,s2163,TV Show,The Rain,Unknown,"Alba August, Lucas Lynggaard Tønnesen, Mikkel Boe Følsgaard, Lukas Løkken, Jessica Dinnage, Sonny Lindberg, Angela Bundalovic, Lars Simonsen","Denmark, United States",2020-08-06,2020,TV-MA,3 Seasons,"International TV Shows, TV Dramas, TV Mysteries","Six years after a brutal virus wipes out most of Scandinavia's population, two siblings join a band of young survivors seeking safety – and answers.",2020,8
2168,s2169,TV Show,Mystery Lab,Unknown,"Felipe Castanhari, Lilian Regina, Bruno Miranda, Guilherme Briggs",Brazil,2020-08-04,2020,TV-PG,1 Season,"Docuseries, International TV Shows, Science & Nature TV","Host Felipe Castanhari explores science, history, mysteries and marvels, uncovering mind-blowing facts with help from his lab buddies.",2020,8
2173,s2174,TV Show,Moesha,Unknown,"Brandy Norwood, William Allen Young, Sheryl Lee Ralph, Countess Vaughn, Lamont Bentley, Shar Jackson, Marcus T. Paulk, Yvette Wilson",United States,2020-08-01,2000,TV-PG,6 Seasons,"TV Comedies, Teen TV Shows","Navigating the twists and firsts of high school, Moesha juggles friendships, romance and the occasional drama while trying to keep her family together.",2020,8
2174,s2175,TV Show,My Perfect Landing,Unknown,"Morgan Wigle, Tom Hulshof, Helena Marie, Shawn Thompson, Natasha Zaborski, Ajanae Stephenson, Francesca Van Keekan, Jordan Clark",Canada,2020-08-01,2020,TV-G,1 Season,Kids' TV,Everything changes for talented young gymnast Jenny Cortez when she moves with her family from Miami to Toronto to open a new gymnastics club.,2020,8
2175,s2176,TV Show,Nagi-Asu: A Lull in the Sea,Unknown,"Natsuki Hanae, Kana Hanazawa, Ai Kayano, Ryota Osaka, Kaito Ishikawa, Mikako Komatsu, Kaori Ishihara, Kaori Nazuka, Masuo Amada, Junji Majima, Motomu Kiyokawa, Kohsuke Toriumi",Japan,2020-08-01,2014,TV-14,1 Season,"Anime Series, Romantic TV Shows, Teen TV Shows","In a world where humans are divided between the land and the sea, four childhood friends from the ocean must attend middle school on the surface.",2020,8
2178,s2179,TV Show,The Next Step,Unknown,"Shamier Anderson, Victoria Baldesarra, Alexandra Beaton, Jordan Clark, Brennan Clost, Samantha Grecchi, Lamar Johnson, Isaac Lupien, Trevor Tordjman, Brittany Raymond, Bree Wasylenko, Jennifer Pappas, Tamina Pollack-Paris, Logan Fabbro, Megan Mackenzie, Alex Beaton, Natalie Krill",Canada,2020-08-01,2018,TV-G,1 Season,"Kids' TV, Reality TV, TV Dramas",This drama series follows young dancers at the Next Step Dance Studio as they attempt to win the coveted regional dance championships.,2020,8
2180,s2181,TV Show,Toradora!,Unknown,"Rie Kugimiya, Junji Majima, Yui Horie, Hirofumi Nojima, Eri Kitamura, Sayaka Ohara, Ai Nonaka, Momoko Ishikawa, Hiroyuki Yoshino, Kazuyuki Okitsu, Rie Tanaka, Yuhko Kaida, Saori Goto",Japan,2020-08-01,2008,TV-14,1 Season,"Anime Series, International TV Shows, Romantic TV Shows","Menacing in appearance but gentle at heart, Ryūji forms an unlikely friendship with Taiga, a tiny girl with a sharp tongue and a tough attitude.",2020,8
2181,s2182,TV Show,Transformers Rescue Bots Academy,Unknown,"Adam Andrianopolous, Pierce Cravens, Xander Crowell, Paul Guyet, Michael Hansen, Mason Hensley, Courtney Shaw, Alan Trinca, Keyon Williams, Andy Zou",United States,2020-08-01,2020,TV-Y,2 Seasons,Kids' TV,"As part of the first class at the Rescue Bots Academy, five Cybertron recruits train under their skilled teachers and take on daring rescue missions.",2020,8
2184,s2185,TV Show,Get Even,Unknown,"Kim Adis, Mia McKenna-Bruce, Bethany Antonia, Jessica Alexander",United Kingdom,2020-07-31,2020,TV-PG,1 Season,"British TV Shows, Crime TV Shows, International TV Shows","In a secret act of skillful revenge, four private school classmates team up and work together to expose a string of schoolwide injustices.",2020,7
2189,s2190,TV Show,Sugar Rush,Unknown,"Candace Nelson, Adriano Zumbo, Hunter March",United States,2020-07-31,2020,TV-PG,3 Seasons,Reality TV,Time's the most important ingredient as teams race against the clock – and each other – to bake up the best-tasting sweets.,2020,7
2192,s2193,TV Show,Transformers: War For Cybertron Trilogy,Unknown,"Jake Foushee, Jason Marnocha, Linsay Rousseau, Joe Zieja, Frank Todaro, Bill Rogers, Keith Silverstein, Edward Bosco",United States,2020-07-30,2020,TV-Y7,1 Season,Anime Series,"As the Autobots and Decepticons ravage their planet in a brutal civil war, two iconic leaders emerge in the Transformers universe's origin story.",2020,7
2201,s2202,TV Show,Last Chance U,Unknown,"John Franklin III, DJ Law, Buddy Stephens, Brittany Wagner, Ronald Ollie",United States,2020-07-28,2020,TV-MA,5 Seasons,Docuseries,"In a docuseries set at one of NCAA football's most fertile recruiting grounds, guys with red flags seek to prove their worth on the field and in class.",2020,7
2203,s2204,TV Show,Shameless (U.S.),Unknown,"William H. Macy, Emmy Rossum, Justin Chatwin, Cameron Monaghan, Jeremy Allen White, Shanola Hampton, Steve Howey, Ethan Cutkosky, Emma Kenney, Laura Wiggins, Joan Cusack",United States,2020-07-26,2019,TV-MA,10 Seasons,"TV Comedies, TV Dramas",This dramedy based on a British series centers on siblings in a dysfunctional Chicago family who struggle while coping with their alcoholic father.,2020,7
2212,s2213,TV Show,Sing On! Spain,Unknown,Ricky Merino,Spain,2020-07-24,2020,TV-G,1 Season,"International TV Shows, Reality TV, Spanish-Language TV Shows","In this fast-paced, high-energy karaoke competition, singers from all walks of life battle it out for up to 30,000 euros!",2020,7
2218,s2219,TV Show,Norsemen,Unknown,"Kåre Conradi, Silje Torp, Nils Jørgen Kaalstad, Marian Saastad Ottesen, Trond Fausa, Kristine Riis, Jon Øigarden, Henrik Mestad, Øystein Martinsen, Mikkel Bratt Silset, Mads Jørgensen, Nikis Theophilakis",Norway,2020-07-22,2020,TV-MA,3 Seasons,"International TV Shows, TV Comedies","The residents of an 8th-century Viking village experience political rivalry, social change and innovations that upend their culture and way of life.",2020,7
2223,s2224,TV Show,Killer Women with Piers Morgan,Unknown,Piers Morgan,United Kingdom,2020-07-19,2017,TV-MA,1 Season,"British TV Shows, Crime TV Shows, Docuseries","Journalist Piers Morgan goes behind prison walls to speak with women convicted of shocking crimes, shedding light on what drove them to murder.",2020,7
2226,s2227,TV Show,Single Wives,Unknown,"Fifi Box, Matthew Hussey",Australia,2020-07-18,2018,TV-MA,1 Season,"Reality TV, Romantic TV Shows","Looking for a second chance at love, four formerly married women are put in various romantic situations then receive feedback from a dating coach.",2020,7
2227,s2228,TV Show,Cursed,Unknown,"Katherine Langford, Devon Terrell, Gustaf Skarsgård, Daniel Sharman, Sebastian Armesto, Lily Newmark, Shalom Brune-Franklin, Matt Stokoe, Bella Dayne, Peter Mullan, Emily Coates","United Kingdom, Australia",2020-07-17,2020,TV-MA,1 Season,"TV Action & Adventure, TV Dramas, TV Sci-Fi & Fantasy","Armed with mysterious powers and a legendary sword, young rebel Nimue joins forces with charming mercenary Arthur on a mission to save her people.",2020,7
2229,s2230,TV Show,In The Dark,Unknown,"Perry Mattfeld, Brooke Markham, Casey Deidrick, Keston John, Morgan Krantz, Rich Sommer, Thamela Mpumlwana, Saycon Sengbloh, Kathleen York, Derek Webster",United States,2020-07-17,2020,TV-14,2 Seasons,"Crime TV Shows, TV Dramas",A blind woman with vices finds herself in the middle of a murder investigation when her best friend turns up dead.,2020,7
2230,s2231,TV Show,Kissing Game,Unknown,"Caio Horowicz, Iza Moreira, Michel Joelsas, Denise Fraga, Thomás Aquino, Luana Nastas, Esther Tinman, Kevin Vechiatto, Grace Passô, Bianca Byington, Bruno Garcia, Flávio Tolezani, Carolina del Carmen Peleritti",Brazil,2020-07-17,2020,TV-MA,1 Season,"International TV Shows, TV Dramas, TV Mysteries","At a high school in a rural, isolated ranching community, families panic when teens contract a mysterious ""kissing disease"" that quickly spreads.",2020,7
2235,s2236,TV Show,Dark Desire,Unknown,"Maite Perroni, Erik Hayser, Alejandro Speitzer, María Fernanda Yepes, Jorge Poza, Regina Pavón, Paulina Matos, Leticia Huijara, Claudia Pineda, Esteban Soberanes, Claudia Ríos, Samantha Orozco, Fabián Merlo, Eligio Meléndez, Carmen Beato, Carlos Torres, Toño Valdés",Mexico,2020-07-15,2020,TV-MA,1 Season,"Crime TV Shows, International TV Shows, Spanish-Language TV Shows","Married Alma spends a fateful weekend away from home that ignites passion, ends in tragedy and leads her to question the truth about those close to her.",2020,7
2238,s2239,TV Show,Sunny Bunnies,Unknown,"Svetlana Tsimokhina, Dmitri Davidovich",Belarus,2020-07-15,2016,TV-Y,2 Seasons,"British TV Shows, Kids' TV, TV Comedies","Furry little bunnies hop through wild adventures as they find solutions, fun and sometimes mischief wherever there is light.",2020,7
2241,s2242,TV Show,The Business of Drugs,Unknown,Amaryllis Fox,United States,2020-07-14,2020,TV-MA,1 Season,Docuseries,"To understand the origins and true impact of the business of drugs, a former CIA analyst investigates the economics of six illicit substances.",2020,7
2246,s2247,TV Show,Down to Earth with Zac Efron,Unknown,"Zac Efron, Darin Olien",United States,2020-07-10,2020,TV-PG,1 Season,"Docuseries, Reality TV, Science & Nature TV","Actor Zac Efron journeys around the world with wellness expert Darin Olien in a travel show that explores healthy, sustainable ways to live.",2020,7
2249,s2250,TV Show,The Epic Tales of Captain Underpants in Space,Unknown,"Nat Faxon, Jay Gragnani, Ramone Hamilton, Sean Astin, Dayci Brookshire, Jorge Diaz, Peter Hastings, Evan Kishiyama, David Koechner, Erica Luttrell, Brennan Murray, Nolan North, Gary Anthony Williams, Secunda Wood",United States,2020-07-10,2020,TV-Y7,1 Season,"Kids' TV, TV Action & Adventure, TV Comedies",Best friends George and Harold — along with their classmates and tyrannical principal — are recruited for a mysterious mission in outer space.,2020,7
2253,s2254,TV Show,Japan Sinks: 2020,Unknown,"Reina Ueda, Tomo Muranaka, Yuko Sasaki, Masaki Terasoma, Hiroyuki Yoshino, Kensho Ono",Japan,2020-07-09,2020,TV-MA,1 Season,"Anime Series, International TV Shows","After catastrophic earthquakes devastate Japan, one family's resolve is tested on a journey of survival through the sinking archipelago.",2020,7
2254,s2255,TV Show,The Protector,Unknown,"Çağatay Ulusoy, Ayça Ayşin Turan, Hazar Ergüçlü, Okan Yalabık, Mehmet Kurtuluş, Yurdaer Okur",Turkey,2020-07-09,2020,TV-MA,4 Seasons,"International TV Shows, Romantic TV Shows, TV Action & Adventure","Discovering his ties to a secret ancient order, a young man living in modern Istanbul embarks on a quest to save the city from an immortal enemy.",2020,7
2255,s2256,TV Show,Was It Love?,Unknown,"Song Ji-hyo, Son Ho-jun, Song Jong-ho, Koo Ja-sung, Kim Min-jun, Kim Da-som, Kim Mee-kyung, Um Chae-young, Kim Young-ah, Kim Byung-choon",South Korea,2020-07-09,2020,TV-14,1 Season,"International TV Shows, Korean TV Shows, Romantic TV Shows","When four very different men appear in her life, a single mother who hasn't dated in years begins to rediscover love — and herself.",2020,7
2258,s2259,TV Show,Stateless,Unknown,"Yvonne Strahovski, Jai Courtney, Cate Blanchett, Asher Keddie, Fayssal Bazzi, Dominic West",Australia,2020-07-08,2020,TV-MA,1 Season,"International TV Shows, TV Dramas","Four strangers — a woman on the run, a brave refugee, a driven bureaucrat and a struggling dad — intersect at an Australian immigration detention center.",2020,7
2292,s2293,TV Show,Little Singham,Unknown,"Swapnil Kumari, Jigna Bhardwaj, Sonal Kaushal, Neshma Chemburkar, Ganesh Divekar, Shaily Dube, Saumya Daan, Anamaya Verma, Parminder Ghumman, Pawan Kalra",India,2020-07-04,2020,TV-Y7,2 Seasons,"Kids' TV, TV Comedies","A spinoff of Rohit Shetty's action franchise, this animated series follows brave kid cop Little Singham’s adventures as he defends his town from evil.",2020,7
2293,s2294,TV Show,Cable Girls,Unknown,"Blanca Suárez, Nadia de Santiago, Ana Fernández, Maggie Civantos, Ana Polvorosa, Yon González, Martiño Rivas, Nico Romero, Borja Luna, Sergio Mur, Concha Velasco, Antonio Velázquez, Ernesto Alterio, Ira del Río, Angela Cremonte, Andrea Carballo",Spain,2020-07-03,2019,TV-MA,6 Seasons,"International TV Shows, Romantic TV Shows, Spanish-Language TV Shows","In 1920s Madrid, four women at the National Telephone Company ring in revolution as they manage romance, friendship and the modern workplace.",2020,7
2297,s2298,TV Show,JU-ON: Origins,Unknown,"Yoshiyoshi Arakawa, Yuina Kuroshima, Ririka, Koki Osamura, Seiko Iwaido, Kai Inowaki, Ryushin Tei, Yuya Matsuura, Kaho Tsuchimura, Takemi Fujii, Ryota Matsushima, Haruka Kubo, Shinsuke Kato, Nana Yanagisawa, Atom Shukugawa, Yura Anno, Tokio Emoto, Nobuko Sendo, Kana Kurashina",Japan,2020-07-03,2020,TV-MA,1 Season,"International TV Shows, TV Horror, TV Mysteries",A paranormal researcher searches obsessively for a cursed home where something terrible happened to a mother and her child long ago.,2020,7
2299,s2300,TV Show,The Baby-Sitters Club,Unknown,"Sophie Grace, Momona Tamada, Shay Rudolph, Malia Baker, Xochitl Gomez, Alicia Silverstone, Mark Feuerstein, Marc Evan Jackson, Aya Furukawa, Jessica Elaina Eason",United States,2020-07-03,2020,TV-G,1 Season,"Kids' TV, TV Dramas",Ann M. Martin's beloved books get a modern update in this series that follows a group of girlfriends and their homegrown babysitting business.,2020,7
2303,s2304,TV Show,Warrior Nun,Unknown,"Alba Baptista, Toya Turner, Lorena Andrea, Kristina Tonteri-Young, Tristán Ulloa",United States,2020-07-02,2020,TV-MA,1 Season,"TV Action & Adventure, TV Mysteries, TV Sci-Fi & Fantasy","After waking up in a morgue, an orphaned teen discovers she now possesses superpowers as the chosen Halo-Bearer for a secret sect of demon-hunting nuns.",2020,7
2305,s2306,TV Show,21 Again,Unknown,Laura Morgan,United Kingdom,2020-07-01,2019,TV-MA,1 Season,"British TV Shows, Reality TV","In a social experiment, a group of daughters sends their mothers, disguised as 21-year-olds, into the world to experience life as a member of Gen Z.",2020,7
2306,s2307,TV Show,A Touch of Green,Unknown,"Weber Yang, Cheryl Yang, Tien Hsin, Gabriel Lan, Wu Kang-jen, Cindy Lien, Wen Chen-ling, Hans Chung",Taiwan,2020-07-01,2016,TV-MA,1 Season,"International TV Shows, TV Dramas","Amid the turmoil of China's civil war, families of Kuomintang pilots face the pain of leaving their homes but find strength in their shared bonds.",2020,7
2313,s2314,TV Show,Say I Do,Unknown,"Jeremiah Brent, Thai Nguyen, Gabriele Bertaccini",United States,2020-07-01,2020,TV-14,1 Season,"Reality TV, Romantic TV Shows","In this reality show, couples overcome obstacles to celebrate their love in surprise dream weddings designed by three experts in less than a week.",2020,7
2320,s2321,TV Show,BNA,Unknown,"Sumire Morohoshi, Yoshimasa Hosoya, Maria Naganawa, Kaito Ishikawa, Gara Takashima, Michiyo Murase",Japan,2020-06-30,2020,TV-14,1 Season,"Anime Series, International TV Shows","Morphed into a raccoon beastman, Michiru seeks refuge, and answers, with the aid of wolf beastman Shirou inside the special zone of Anima-City.",2020,6
2327,s2328,TV Show,Dark,Unknown,"Louis Hofmann, Oliver Masucci, Jördis Triebel, Maja Schöne, Karoline Eichhorn, Sebastian Rudolph, Anatole Taubman, Mark Waschke, Stephan Kampwirth, Anne Ratte-Polle, Andreas Pietschmann, Lisa Vicari, Michael Mendl, Angela Winkler","Germany, United States",2020-06-27,2020,TV-MA,3 Seasons,"Crime TV Shows, International TV Shows, TV Dramas",A missing child sets four families on a frantic hunt for answers as they unearth a mind-bending mystery that spans three generations.,2020,6
2329,s2330,TV Show,All For Love,Unknown,"Ana María Estupiñán, Carlos Torres, Yuri Vargas, Jim Muñoz, Julio Sánchez Cóccaro, Alina Lozano, Valeria Gálviz, Juan Millán, Juan del Río, Mario Duarte",Colombia,2020-06-26,2020,TV-MA,1 Season,"International TV Shows, Romantic TV Shows, Spanish-Language TV Shows","A penniless country boy goes in search of his runaway sister in Bogotá, where he falls for an aspiring singer, but gets tangled up in organized crime.",2020,6
2337,s2338,TV Show,Twogether,Unknown,"Lee Seung-gi, Jasper Liu",South Korea,2020-06-26,2020,TV-G,1 Season,"International TV Shows, Korean TV Shows, Reality TV","Paired together for an unforgettable trip across Asia, stars Lee Seung-gi and Jasper Liu become buddies as they connect with fans and local cultures.",2020,6
2343,s2344,TV Show,Crazy Delicious,Unknown,"Jayde Adams, Carla Hall, Heston Blumenthal, Niklas Ekstedt",United Kingdom,2020-06-24,2020,TV-PG,1 Season,"British TV Shows, International TV Shows, Reality TV","In this competition show, daring home chefs tempt the food gods with reinvented classics and fanciful feasts in their quest to win a golden apple.",2020,6
2346,s2347,TV Show,"Roswell, New Mexico",Unknown,"Jeanine Mason, Nathan Parsons, Michael Vlamis, Lily Cowles, Tyler Blackburn, Heather Hemmens, Michael Trevino, Trevor St. John",United States,2020-06-23,2020,TV-14,2 Seasons,"Classic & Cult TV, TV Dramas, TV Sci-Fi & Fantasy","After 10 years, a woman returns to her sleepy tourist-occupied hometown and discovers her high-school crush is also an unusual foreigner.",2020,6
2349,s2350,TV Show,It's Okay to Not Be Okay,Unknown,"Kim Soo-hyun, Seo Yea-ji, Oh Jung-se, Park Gyu-young, Kim Ju-hun, Kim Chang-wan, Kim Mee-kyung, Kang Ki-doong, Jang Young-nam",South Korea,2020-06-21,2020,TV-MA,1 Season,"International TV Shows, Korean TV Shows, Romantic TV Shows",An extraordinary road to emotional healing opens up for an antisocial children's book writer and a selfless psych ward caretaker when they cross paths.,2020,6
2357,s2358,TV Show,Floor Is Lava,Unknown,Rutledge Wood,United States,2020-06-19,2020,TV-PG,1 Season,Reality TV,"Teams compete to navigate rooms flooded with lava by leaping from chairs, hanging from curtains and swinging from chandeliers. Yes, really.",2020,6
2359,s2360,TV Show,Most Beautiful Thing,Unknown,"Maria Casadevall, Pathy Dejesus, Fernanda Vasconcellos, Mel Lisboa, Leandro Lima, Ícaro Silva, Gustavo Vaz, Alexandre Cioletti, Gustavo Machado",Brazil,2020-06-19,2020,TV-MA,2 Seasons,"International TV Shows, Romantic TV Shows, TV Dramas","A 1950s housewife goes to Rio de Janeiro to meet up with her husband, only to learn he's deserted her, but decides to stay and open a bossa nova club.",2020,6
2362,s2363,TV Show,The Politician,Unknown,"Ben Platt, Gwyneth Paltrow, Jessica Lange, Zoey Deutch, Lucy Boynton, Bob Balaban, David Corenswet, Julia Schlaepfer, Laura Dreyfuss, Theo Germaine, Rahne Jones, Benjamin Barrett",United States,2020-06-19,2020,TV-MA,2 Seasons,"TV Comedies, TV Dramas, Teen TV Shows",Rich kid Payton has always known he's going to be president. But first he has to navigate the most treacherous political landscape of all: high school.,2020,6
2378,s2379,TV Show,The Order,Unknown,"Jake Manley, Sarah Grey, Max Martini, Matt Frewer, Adam DiMarco, Katharine Isabelle, Louriza Tronco, Aaron Hale, Devery Jacobs, Thomas Elms, Dylan Playfair, Ian Tracey, Sam Trammell",United States,2020-06-18,2020,TV-MA,2 Seasons,"International TV Shows, TV Dramas, TV Horror","Out to avenge his mother's death, a college student pledges a secret order and lands in a war between werewolves and practitioners of dark magic.",2020,6
2383,s2384,TV Show,The Chase,Unknown,"Brooke Burns, Mark Labbett",United States,2020-06-15,2015,TV-PG,2 Seasons,Reality TV,"Brooke Burns hosts this game show in which three contestants square off to answer fast-paced questions against ""the Beast,"" a trivia know-it-all.",2020,6
2384,s2385,Movie,The Show Must Go On: The Queen + Adam Lambert Story,Unknown,"Adam Lambert, Brian May, Roger Taylor","United Kingdom, United States",2020-06-15,2019,TV-MA,85 min,"Documentaries, Music & Musicals","With rare footage and candid interviews, this documentary details the serendipitous pairing of legendary rock band Queen and powerhouse Adam Lambert.",2020,6
2388,s2389,TV Show,Alexa & Katie,Unknown,"Paris Berelc, Isabel May, Tiffani Thiessen, Emery Kelly, Jolie Jenkins, Kerri Medders, Finn Carr, Eddie Shin",United States,2020-06-13,2020,TV-G,4 Seasons,"Kids' TV, TV Comedies","Alexa is battling cancer. But with her best friend, Katie, by her side, she's also starting high school – and ready for whatever comes next.",2020,6
2390,s2391,TV Show,How to Get Away with Murder,Unknown,"Viola Davis, Billy Brown, Alfred Enoch, Jack Falahee, Katie Findlay, Aja Naomi King, Matt McGorry, Karla Souza, Charlie Weber, Liza Weil",United States,2020-06-13,2020,TV-14,6 Seasons,"Crime TV Shows, TV Dramas, TV Mysteries","Brilliant criminal defense attorney and law professor Annalise Keating, plus five of her students, become involved in a twisted murder case.",2020,6
2395,s2396,TV Show,F is for Family,Unknown,"Bill Burr, Laura Dern, Justin Long, Debi Derryberry, Sam Rockwell","United States, France, Canada",2020-06-12,2020,TV-MA,4 Seasons,TV Comedies,"Follow the Murphy family back to the 1970s, when kids roamed wild, beer flowed freely and nothing came between a man and his TV.",2020,6
2396,s2397,TV Show,Frank Elstner: Just One Last Question,Unknown,"Klaas Heufer-Umlauf, Joko Winterscheidt, Lena Meyer-Landrut, Charlotte Roche, Daniel Brühl, Frank Elstner",Germany,2020-06-12,2020,TV-MA,1 Season,"International TV Shows, Stand-Up Comedy & Talk Shows","In his farewell show, legendary German host Frank Elstner digs deep and savors his discussions with stars such as Daniel Brühl and Lena Meyer-Landrut.",2020,6
2399,s2400,TV Show,ONE PIECE,Unknown,"Mayumi Tanaka, Akemi Okamura, Kazuya Nakai, Kappei Yamaguchi, Hiroaki Hirata, Ikue Otani, Yuriko Yamaguchi, Kazuki Yao, Cho",Japan,2020-06-12,2002,TV-14,4 Seasons,Anime Series,Monkey D. Luffy sails with his crew of Straw Hat Pirates through the Grand Line to find the treasure One Piece and become the new king of the pirates.,2020,6
2400,s2401,TV Show,The Search,Unknown,"Darío Yazbek, Diana Bovio, Regina Blandón, Adrián Ladrón, Verónica Bravo, Antonio Arochi, Mario Alberto Monroy, Vianey Rodríguez, María Aura, Daniel Haddad, Fernando Bonilla, Olinca Velázquez, Damayanti Quintanar, Adriana Llabrés, Alejandro Calva, Silverio Palacios, Edmundo Vargas, Anabel Ferreira",Mexico,2020-06-12,2020,TV-MA,1 Season,"Crime TV Shows, International TV Shows, Spanish-Language TV Shows","When a girl vanishes from a suburb near Mexico City, the personal goals of some involved in the case muddy the search. Based on a true story.",2020,6
2401,s2402,TV Show,The Woods,Unknown,"Grzegorz Damięcki, Agnieszka Grochowska, Hubert Miłkowski, Wiktoria Filus, Jacek Koman, Krzysztof Zarzecki, Ewa Skibińska, Martyna Byczkowska, Roman Gancarczyk, Adam Wietrzyński","Poland, United States",2020-06-12,2020,TV-MA,1 Season,"Crime TV Shows, International TV Shows, TV Dramas",Evidence found on the body of a homicide victim sparks hope in a prosecutor that his sister who disappeared 25 years earlier could still be alive.,2020,6
2404,s2405,TV Show,Curon,Unknown,"Valeria Bilello, Luca Lionello, Federico Russo, Margherita Morchio, Anna Ferzetti, Alessandro Tedeschi, Juju Di Domenico, Giulio Brizzi, Max Malatesta",Italy,2020-06-10,2020,TV-MA,1 Season,"International TV Shows, TV Dramas, TV Horror","After 17 years, a woman returns home with her teenage twins. When she mysteriously vanishes, her children must reckon with a shadowy family legacy.",2020,6
2408,s2409,TV Show,My Mister,Unknown,"Lee Sun-kyun, Lee Ji-eun (IU), Go Du-sim, Park Ho-san, Song Sae-byeok, Kim Young-min",South Korea,2020-06-10,2018,TV-MA,1 Season,"Crime TV Shows, International TV Shows, Korean TV Shows","In a world that is less than kind, a young woman and a middle-aged man develop a sense of kinship as they find warmth and comfort in one another.",2020,6
2409,s2410,TV Show,Reality Z,Unknown,"Ana Hartmann, Sabrina Sato, Luellem de Castro, Guilherme Weber, Emílio de Mello, Ravel Andrade, João Pedro Zappa, Julia Ianina, Pierre Baitelli, Jesus Luz, Carla Ribas, Wallie Ruy, Gabriel Canella, Natália Rosa, Priscila Assum, Teca Pereira, Leandro Daniel, Hanna Romanazzi, Arlinda Di Baio, Erom Cordeiro, Enzo Romani",Brazil,2020-06-10,2020,TV-MA,1 Season,"International TV Shows, TV Horror, TV Mysteries","With Rio de Janeiro under a zombie attack, reality show contestants shelter in a TV studio, where they must deal with more than flesh-eating hordes.",2020,6
