,show_id,type,title,director,cast,country,date_added,release_year,rating,duration,listed_in,description,year_added,month_added
5422,s5423,TV Show,Pac-Man and the Ghostly Adventures,Unknown,"Erin Mathews, Sam Vincent, Andrea Libman, Ashleigh Ball, Ian James Corlett, Brian Drummond, Lee Tockar, Matt Hill","United States, Japan, Canada",2017-06-20,2014,TV-Y7,2 Seasons,"Kids' TV, TV Comedies",Teenage Pac and his loyal crew face the ups and downs of adolescence while protecting Pac-World from a ghostly army led by the evil Betrayus.,2017,6
5425,s5426,TV Show,Aquarius,Unknown,"David Duchovny, Gethin Anthony, Grey Damon, Emma Dumont, Claire Holt, Michaela McManus, Brían F. O'Byrne, David Meunier, Ambyr Childers, Tara Lynne Barr, Whitney Rose Pynn, Jason Ralph",United States,2017-06-16,2016,TV-MA,2 Seasons,"Crime TV Shows, TV Dramas","Amid the turmoil of 1960s LA, two cops and a prominent political family are drawn into the sex- and drug-fueled web of a young Charles Manson.",2017,6
5433,s5434,TV Show,28 Moons,Unknown,"Jin-sung Yang, Kyu-jong Kim, Tae-hwan Kang, Geummi",South Korea,2017-06-10,2016,TV-PG,1 Season,"International TV Shows, Korean TV Shows, Romantic TV Shows","When her fiancé acts strangely upon receiving a mysterious invitation, a florist sets out to find out the truth behind the tiny scrap of paper.",2017,6
5434,s5435,TV Show,Magic Phone,Unknown,"Jin-woo Kim, Min-ji Park, In-jun Gwak, Gi-du Kim",South Korea,2017-06-10,2016,TV-PG,1 Season,"International TV Shows, Korean TV Shows, Romantic TV Shows","When an ordinary guy crosses paths 15 years later with his childhood sweetheart, now an actress, a magic cellphone allows him to be her protector.",2017,6
5436,s5437,TV Show,My Little Baby,Unknown,"Ji-ho Oh, Soo-kyung Lee, Min-jae Kim, Ji-hyun Nam",South Korea,2017-06-10,2016,TV-PG,1 Season,"Crime TV Shows, International TV Shows, Korean TV Shows",A top detective in the violent crimes unit becomes the sole guardian of his 6-month-old niece when his sister and her husband pass away unexpectedly.,2017,6
5437,s5438,TV Show,Singles Villa,Unknown,"Joe Cheng, Lulu Xu, Jiro Wang, Viann Zhang, Han Chengyu",China,2017-06-10,2015,TV-14,1 Season,"International TV Shows, Romantic TV Shows, TV Dramas","In a luxurious condominium complex with draconian rules forbidding all romance, two residents fall in love and dare to start a secret relationship.",2017,6
5438,s5439,TV Show,Under the Black Moonlight,Unknown,"Tae-hyun Nam, Soo-yeon Kim, Seo-ra Kim, Tae-hwan Kang, Young-jo Yang",South Korea,2017-06-10,2016,TV-14,1 Season,"International TV Shows, Korean TV Shows, TV Dramas",A college art club welcomes a new member who has the secret ability to smell death and who warns one of them to leave her boyfriend ... or else.,2017,6
5439,s5440,TV Show,My Only Love Song,Unknown,"Seung-yeon Gong, Jong-hyun Lee, Yeon-seo Kim, Bo-hyun Ahn, Jai-jin Lee, Joo-hyung Park",South Korea,2017-06-09,2017,TV-MA,1 Season,"International TV Shows, Korean TV Shows, Romantic TV Shows","When things don't go her way during a shooting for her new show, a top actress runs away in an old van that guides her on a time-traveling journey.",2017,6
5444,s5445,TV Show,Crashing,Unknown,"Phoebe Waller-Bridge, Jonathan Bailey, Adrian Scarborough, Damien Molony, Louise Ford, Julie Dray, Amit Shah",United Kingdom,2017-06-02,2016,TV-MA,1 Season,"British TV Shows, International TV Shows, Romantic TV Shows","In exchange for low rent, a hodgepodge group of 20-something tenants set up residence as property guards in a disused hospital, where hilarity ensues.",2017,6
5445,s5446,TV Show,Flaked,Unknown,"Will Arnett, David Sullivan, Ruth Kearney, George Basil, Lina Esco, Travis Mills, Robert Wisdom, Mark Boone Junior, Matthew Willig, Heather Graham, Kirstie Alley, Sab Shimono, Christopher Mintz-Plasse, Minerva Garcia, Jeff Daniel Phillips",United States,2017-06-02,2017,TV-MA,2 Seasons,"TV Comedies, TV Dramas","In his funky California beach enclave, Chip's the go-to guy for personal insights. But he isn't quite as enlightened when it comes to his own baggage.",2017,6
5457,s5458,TV Show,Mind Game,Unknown,"Tay Ping Hui, Joanne Peh, Zhang Yaodong, Paige Chua, Akit Tay",Singapore,2017-06-01,2015,TV-14,1 Season,"Crime TV Shows, International TV Shows, TV Dramas","With the help of a cop, a psychologist and a woman who can foretell the future, a brilliant paralegal works to solve an array of perplexing mysteries.",2017,6
5459,s5460,TV Show,Off Camera,Unknown,Sam Jones,United States,2017-06-01,2015,TV-MA,3 Seasons,Stand-Up Comedy & Talk Shows,"Photographer, writer and director Sam Jones sets his famous guests at ease with his freewheeling, insightful celebrity interviews without agendas.",2017,6
5464,s5465,TV Show,The Day Will Come,Unknown,"Sofie Gråbøl, Lars Mikkelsen, Harald Kaiser Hermann, Albert Rudbeck Lindhardt, Laurids Skovgaard Andersen, Søren Sætter Lassen, Sonja Richter, David Dencik, Solbjørg Højfeldt, Lars Ranthe",Denmark,2017-06-01,2016,TV-14,1 Season,"International TV Shows, TV Dramas","In 1967, two brothers from Copenhagen, Denmark, wind up in an orphanage, where the headmaster's cruel tyranny slowly provokes the kids to push back.",2017,6
5465,s5466,TV Show,The Dream Job,Unknown,"Hugo Ng, Shaun Chen, Jeanette Aw, Rebecca Lim, Zhang Zhenhuan, Ian Fang",Singapore,2017-06-01,2016,TV-14,1 Season,"International TV Shows, TV Dramas","A mysterious, wealthy man offers three people a lucrative, unusual job that may be too good to be true: Live the high life as his children and heirs.",2017,6
5470,s5471,TV Show,Bloodline,Unknown,"Kyle Chandler, Ben Mendelsohn, Sissy Spacek, Linda Cardellini, Norbert Leo Butz, Jacinda Barrett, Jamie McShane, John Leguizamo, Enrique Murciano, Sam Shepard, Chloë Sevigny, Andrea Riseborough, Beau Bridges, Taylor Rouviere, Owen Teague, Brandon Larracuente",United States,2017-05-26,2017,TV-MA,3 Seasons,"TV Dramas, TV Mysteries, TV Thrillers","When the black sheep son of a respected family threatens to expose dark secrets from their past, sibling loyalties are put to the test.",2017,5
5477,s5478,TV Show,Highland: Thailand's Marijuana Awakening,Unknown,Sebastian Perry,Thailand,2017-05-19,2017,TV-MA,1 Season,"Docuseries, International TV Shows","Thailand's complicated history with marijuana continues to play a role in its policies and laws, as well as the health and security of its citizens.",2017,5
5494,s5495,TV Show,Kazoops!,Unknown,"Reece Pockney, Scott Langley, Alex Babic, Gemma Harvey, Jessica Hann, Emma Tate",Australia,2017-05-05,2017,TV-Y,3 Seasons,Kids' TV,Music meets imagination in this inventive animated series about thinking outside the box and having fun.,2017,5
5509,s5510,TV Show,Jumping Girl,Unknown,"Luna, U-kwon, Ha-na Jung, B-Bomb, Ha-seong Park",South Korea,2017-04-28,2015,TV-14,1 Season,"International TV Shows, Korean TV Shows, Romantic TV Shows","Sang-ah would do anything to shield pop star Ah-shin from rabid fans. But after an act of protection gone wrong, it looks like she's the crazy one.",2017,4
5510,s5511,TV Show,President,Unknown,"Su-jong Choi, Hee-Ra Ha, Jay Kim, Ji-hye Wang, Shin-il Kang",South Korea,2017-04-28,2010,TV-14,1 Season,"International TV Shows, Korean TV Shows, TV Dramas","An ambitious, talented politician embarks on an intense journey toward winning the presidency while juggling his complicated family affairs.",2017,4
5513,s5514,TV Show,What in the World Happened?,Unknown,"Eun-mi Go, Jaehyo, Eun-Hyung Jo, Ha-yeon Kim, Shin Yi, Kwang-sun Park",South Korea,2017-04-28,2015,TV-14,1 Season,"International TV Shows, Korean TV Shows, Romantic TV Shows",A happy secret romance between a 40-year-old woman and a 25-year-old man is complicated after a greeting card grants her wish to be young again.,2017,4
5514,s5515,TV Show,Mar de Plástico,Unknown,"Rodolfo Sancho, Belén López, Pedro Casablanc, Luis Fernández, Patrick Criado, Nya de la Rubia, Jesús Castro, Fernando Cayo",Spain,2017-04-27,2017,TV-MA,2 Seasons,"Crime TV Shows, International TV Shows, Spanish-Language TV Shows","In a town in southern Spain where racial tensions run high among the workers in its many greenhouses, a cop investigates the murder of a young woman.",2017,4
5519,s5520,TV Show,Fangbone,Unknown,"Taylor Abrahamse, Colin Doyle, Juan Chioran, Kathleen Laskey, Stacey DePass, Mike Kiss",Canada,2017-04-22,2016,TV-Y7,1 Season,"Kids' TV, TV Comedies","Magically transported from far-off Skullbania, a young barbarian teams up with an odd third-grader to protect his homeland from an evil sorcerer.",2017,4
5520,s5521,TV Show,Girlboss,Unknown,"Britt Robertson, Ellie Reed, Johnny Simmons, Alphonso Mcauley",United States,2017-04-21,2017,TV-MA,1 Season,TV Comedies,"Rebellious and broke, Sophia stumbles into creating an online business and learns how to be the boss. A comedy inspired by the best-selling memoir.",2017,4
5523,s5524,TV Show,The Mr. Peabody and Sherman Show,Unknown,"Chris Parnell, Max Charles, Dieter Jansen, Da'Vine Joy Randolph",United States,2017-04-21,2017,TV-Y7,4 Seasons,"Kids' TV, TV Comedies","Mr. Peabody and Sherman host a zany late-night comedy show from a swanky penthouse, with time-traveling historical figures and a live audience.",2017,4
5537,s5538,TV Show,The Miracle,Unknown,"Donghyun Kim, Nahyun, Yang Hak Jin, Yoon Hwa Hong",South Korea,2017-04-10,2016,TV-14,1 Season,"International TV Shows, Korean TV Shows, TV Dramas","Polar opposites in personality and looks, fraternal twin sisters who live completely different lives wake up one day to find they've switched bodies.",2017,4
5538,s5539,TV Show,The Get Down,Unknown,"Justice Smith, Shameik Moore, Herizen Guardiola, Skylan Brooks, Tremaine Brown,  Jr., Yahya Abdul-Mateen II, Jimmy Smits, Giancarlo Esposito, Kevin Corrigan, Stefanee Martin, Shyrley Rodriguez, Eric Bogosian, Michel Gill, Mamoudou Athie",United States,2017-04-07,2017,TV-MA,2 Seasons,TV Dramas,"In 1977 New York City, the talented and soulful youth of the South Bronx chase dreams and breakneck beats to transform music history.",2017,4
5542,s5543,TV Show,Burned Cocoon,Unknown,"Yavuz Bingöl, Basak Köklükaya, Çolpan Ilhan, Mustafa Alabora, Sedef Avcı, Ayça İnci, Tuncer Necmioğlu, Serdar Özer",Turkey,2017-04-01,2005,TV-MA,1 Season,"International TV Shows, TV Dramas","A secret marriage unites two families – one wealthy and traditional, the other bankrupt and modern – and is threatened by the resulting conflicts.",2017,4
5553,s5554,Movie,Bridget Christie: Stand Up for Her,Unknown,Bridget Christie,United Kingdom,2017-03-31,2016,TV-MA,51 min,Stand-Up Comedy,"Performing stand-up for a packed house in London's Hoxton Hall, comedian Bridget Christie dives into the politics of gender, sex and equality.",2017,3
5558,s5559,TV Show,Bottersnikes & Gumbles,Unknown,"Jason Callender, Kathryn Drysdale, Akiya Henry, Jeff Rawle, Richard Grieve, Simone Craddock, Alex Babic, Miriam Margolyes","United States, United Kingdom, Australia",2017-03-24,2017,TV-Y7,2 Seasons,"British TV Shows, Kids' TV",The fun-loving Gumbles bounce and play while staying away from the foul-smelling Bottersnikes who live in a nearby junkyard.,2017,3
5563,s5564,TV Show,One-Punch Man,Unknown,"Makoto Furukawa, Kaito Ishikawa, Yuki Kaji, Aoi Yuki, Kazuhiro Yamaji, Kenjiro Tsuda, Minami Takayama, Tessho Genda",Japan,2017-03-20,2015,TV-14,1 Season,"Anime Series, Crime TV Shows, International TV Shows","The most powerful superhero in the world can kill anyone with one blow. But nothing can challenge him, so he struggles with ennui and depression.",2017,3
5566,s5567,TV Show,Julie's Greenroom,Unknown,"Julie Andrews, Giullian Yao Gioiello, Jennifer Barnhart, Tyler Bunch, Frankie Cordero, Stephanie D'Abruzzo, Dorien Davies, John Kennedy, John Tartaglia",United States,2017-03-17,2017,TV-Y,1 Season,Kids' TV,Adorable puppets stage their own musical under the watchful eye of mentor Julie Andrews in this original kids' series from the Jim Henson Company.,2017,3
5569,s5570,TV Show,Samurai Gourmet,Unknown,"Naoto Takenaka, Tetsuji Tamayama, Honami Suzuki",Japan,2017-03-17,2017,TV-PG,1 Season,"International TV Shows, TV Dramas",Recent retiree Takeshi rediscovers his passion for food and life by getting in touch with his inner warrior and eating what he truly desires.,2017,3
5578,s5579,TV Show,Buddy Thunderstruck,Unknown,"Brian Atkinson, Ted Raimi, Harry Chaskin, Justin Michael, Debi Derryberry, Philip Maurice Hayes, Leigh Kelly, J.D. Ryznar, Nick Shakoour, Ryan Wiesbrock, Clark Wiesbrock",United States,2017-03-10,2017,TV-Y7,1 Season,"Kids' TV, TV Comedies","Follow the outrageous, high-octane adventures of Buddy Thunderstruck, a truck-racing dog who brings guts and good times to the town of Greasepit.",2017,3
5580,s5581,TV Show,One More Time,Unknown,"L, So-hui Yoon, Gi-du Kim, Chang-hwan Kim, Ji Su, Tae-im Lee, Nam-gil Kang",South Korea,2017-03-10,2016,TV-14,1 Season,"International TV Shows, Korean TV Shows, Romantic TV Shows",This fantasy drama follows an indie band singer who repeatedly undergoes unwanted time slips and the girlfriend he must save from an unlucky fate.,2017,3
5583,s5584,TV Show,Love Is in the Air,Unknown,"Murat Ünalmış, Birce Akalay, Selen Soyder, Erman Okay, Kanbolat Gorkem Arslan, Levent Yilmaz, Aysegül Günay, Selma Kutluğ, Ulvi Alacakaptan, İpek Erdem, Yilmaz Calayir, Isil Yücesoy",United Kingdom,2017-03-01,2010,TV-14,1 Season,"International TV Shows, TV Dramas","Toprak, who lost her baby, is hired as a wet nurse for wealthy Yusuf's motherless son. Yusuf is drawn to Toprak, but also to her scheming sister.",2017,3
5585,s5586,TV Show,Tong: Memories,Unknown,"Lee Hak Joo, Ji-an Kim, Jae-yoon Lee, Heo Ji Won, Yang Hak Jin, Choi Yeong Min",South Korea,2017-03-01,2016,TV-MA,1 Season,"International TV Shows, Korean TV Shows, TV Action & Adventure",A tough young man with a short temper and no patience for bullies gains a legendary reputation as the best street fighter in Busan.,2017,3
5591,s5592,TV Show,Legend Quest,Unknown,"Benny Emmanuel, Mayté Cordeiro, Andrés Couturier, Ricardo O'Farrill, Alondra Hidalgo, Alejandro Villeli, Sofía Niño de Rivera, Johnny Rose, Annemarie Blanco, Oscar Cheda, Paul Tei, Cydney J. Fam, Lisa Grossman",Mexico,2017-02-24,2017,TV-Y7,1 Season,Kids' TV,"When an evil force threatens his village, a gifted teen who can talk to ghosts puts his skills to good use, one legend at a time.",2017,2
5592,s5593,TV Show,The Sound of Your Heart,Unknown,"Kwang-soo Lee, Dae-Myung Kim, So-min Jung, Byeong-ok Kim, Mi-kyung Kim",South Korea,2017-02-24,2016,TV-14,1 Season,"International TV Shows, Korean TV Shows, TV Comedies","Based on Korea's longest-running webtoon series, this comedy follows the ridiculous daily lives of a cartoonist, his girlfriend and his subpar family.",2017,2
5593,s5594,TV Show,Love Me As I Am,Unknown,"Alper Saldıran, Zeynep Çamcı, Burcu Altın, Umut Kurt, Eda Ece, Ozan Osmanpaşaoğlu, Mert Turak, Burcu Biricik, Yusuf Akgün, Selen Uçer",Turkey,2017-02-22,2015,TV-PG,3 Seasons,"International TV Shows, Romantic TV Shows, TV Comedies","After wealthy college boy Ömer and lower class college girl Aysem fall in love and quickly marry, they learn that love and life aren't always perfect.",2017,2
5598,s5599,TV Show,Love for Ten: Generation of Youth,Unknown,"Sung-yeol Lee, Ji-hyun Nam, Clara Lee, Jin Won",South Korea,2017-02-17,2013,TV-14,1 Season,"International TV Shows, Korean TV Shows, Romantic TV Shows","A nerdy engineering student falls for a pretty, outgoing girl at his college. To get closer to her, he joins the theater group she belongs to.",2017,2
5601,s5602,TV Show,Nightmare High,Unknown,"So-hyun Kim, Min-hyuk Lee, Ki-joon Uhm, Da-Ye Kim, Seung-do Baek, Shin-ae Seo",South Korea,2017-02-15,2016,TV-14,1 Season,"International TV Shows, Korean TV Shows, TV Dramas","After a new teacher arrives, students' dreams begin to come true. Class president Ye-rim must solve the nightmarish mystery before it's too late.",2017,2
5603,s5604,TV Show,Spark,Unknown,"Jong-chan Na, Bo-ra Nam, Da-young Joo, Yeo One, Ki-sung Bae, Jin-joo Park, Eun-soo Kwon",South Korea,2017-02-15,2016,TV-PG,1 Season,"International TV Shows, Korean TV Shows, Romantic TV Shows",A young woman's life gets a jump-start after she and a musical genius are both struck by the same falling star. But will the side effects derail love?,2017,2
5608,s5609,TV Show,White Nights,Unknown,"Yo-Won Lee, Goo Jin, U-ie, Hae-in Jung, Gook-hwan Jeon, Han-yong Jeong",South Korea,2017-02-14,2016,TV-14,1 Season,"International TV Shows, Korean TV Shows, TV Dramas","A coldhearted heiress, a man from her past and an ambitious new hire in her company all become entangled on a battleground for money and power.",2017,2
5609,s5610,TV Show,Cyborg 009: Call of Justice,Unknown,"Keisuke Koumoto, Risa Taneda, Misato Fukuen, Takuya Sato, Satoshi Hino, Kenji Nomura, Mitsuaki Madono, Setsuji Sato, Haruki Ishiya, Ryo Sugisaki, Yui Makino, Kazuhiko Inoue, Yuko Kaida",Japan,2017-02-10,2017,TV-14,1 Season,"Anime Series, International TV Shows","Years after taking up normal lives incognito, the cyborgs are forced to fight again when the superhuman Blessed appear with a plan for humanity.",2017,2
5611,s5612,Movie,Grillo vs Grillo,Unknown,Beppe Grillo,Italy,2017-02-10,2017,TV-MA,96 min,Stand-Up Comedy,"Outspoken comedian Beppe Grillo reminisces about his long career, including the triumphs and controversies that fueled his rise in Italian politics.",2017,2
5640,s5641,TV Show,We're Lalaloopsy,Unknown,"Mariee Devereux, Kazumi Evans, Maryke Hendrikse, Matt Hill, Diana Kaarina, Jocelyne Loewen, Sabrina Pitre",United States,2017-01-10,2017,TV-Y,1 Season,"Kids' TV, TV Comedies","The Lalaloopsy gang and their adorable pets know every day is a perfect day to celebrate the magic of friendship, creativity and collaboration.",2017,1
5650,s5651,TV Show,Star Trek: Deep Space Nine,Unknown,"Avery Brooks, Nana Visitor, Rene Auberjonois, Cirroc Lofton, Alexander Siddig, Colm Meaney, Armin Shimerman, Terry Farrell, Michael Dorn",United States,2017-01-01,1999,TV-14,7 Seasons,"TV Action & Adventure, TV Sci-Fi & Fantasy","In this ""Star Trek"" spin-off, Commander Sisko leads the multi-species crew of Deep Space Nine, a Federation space station with a complex mission.",2017,1
5653,s5654,TV Show,My Runway,Unknown,"Ji-yeon Park, Dong-ho Kang, Chul-woong Kang, Bo-hyun Ahn, Hak Jin, Se-jin Park, Kisum",South Korea,2016-12-30,2016,TV-14,1 Season,"International TV Shows, Korean TV Shows, Romantic TV Shows",An egotistic top male model and a pretty model wannabe are forced to live each other's lives until they figure out a way to undo their body switch.,2016,12
5654,s5655,TV Show,AJIN: Demi-Human,Unknown,"Mamoru Miyano, Yoshimasa Hosoya, Jun Fukuyama, Hochu Otsuka, Daisuke Hirakawa, Takahiro Sakurai, Mikako Komatsu, Hiroyuki Kinoshita, Aya Suzaki",Japan,2016-12-27,2016,TV-MA,2 Seasons,"Anime Series, International TV Shows",A teenager discovers that he is an Ajin and flees before the authorities experiment on him. Other Ajin plan to fight back and he must choose a side.,2016,12
5655,s5656,TV Show,Chasing Cameron,Unknown,"Cameron Dallas, Aaron Carpenter, Taylor Caniff, Willie Jones, Trey Schafer, Bart Bordelon, Blake Gray",United States,2016-12-27,2016,TV-14,1 Season,"Reality TV, Teen TV Shows",Go behind the scenes with social media sensation Cameron Dallas as he takes his career to the next level on an international tour.,2016,12
5658,s5659,TV Show,Sense8,Unknown,"Tuppence Middleton, Brian J. Smith, Doona Bae, Max Riemelt, Naveen Andrews, Daryl Hannah, Freema Agyeman, Terrence Mann, Adam Shapiro, Max Mauff, Alfonso Herrera, Eréndira Ibarra, Aml Ameen, Jamie Clayton, Tina Desae, Miguel Ángel Silvestre, Toby Onwumere, Joe Pantoliano",United States,2016-12-23,2018,TV-MA,2 Seasons,"Crime TV Shows, TV Dramas, TV Mysteries","From the creators of ""The Matrix"" and ""Babylon 5"" comes this tense series in which eight people can telepathically experience each other's lives.",2016,12
5662,s5663,TV Show,Crazyhead,Unknown,"Cara Theobold, Susan Wokoma, Riann Steele, Arinzé Kene, Lewis Reeves, Tony Curran",United Kingdom,2016-12-16,2016,TV-MA,1 Season,"British TV Shows, International TV Shows, TV Comedies",Bowling alley worker Amy and nonconformist Raquel kick some serious demon butt while also facing their inner demons as they navigate their early 20s.,2016,12
5665,s5666,TV Show,Color of Woman,Unknown,"Jae Hee, Soo-kyung Lee, So-yi Yoon, Ji-ho Shim, Sang-Myeon Park, Joo-young Kim",South Korea,2016-12-15,2012,TV-PG,1 Season,"International TV Shows, Korean TV Shows, Romantic TV Shows","Two women at a cosmetics company compete for love and success. One uses her brain and diligence, while the other works her beauty and charm.",2016,12
5667,s5668,TV Show,Goodbye My Wife,Unknown,"Soo-hyun Hong, Si Won Ryu, Ji-yoon Park, Min-soo Kim, Julien Kang, Joo-eun Oh, Seong-mo Jeong",South Korea,2016-12-15,2012,TV-14,1 Season,"International TV Shows, Korean TV Shows, Romantic TV Shows",A couple’s five-year marriage is put on the line when each of their first loves comes back hoping for another shot at romance.,2016,12
5668,s5669,TV Show,Happy And,Unknown,"Hee-Jin Lee, Hae-seong Kwon, Paul Stafford, Mi-ji Lee, Ik-tae Kim, Ki-hyeon Kim",South Korea,2016-12-15,2012,TV-14,1 Season,"International TV Shows, Korean TV Shows, TV Dramas",This relatable relationship drama explores the real-life trials and joys of married life through the lens of 11 different wives.,2016,12
5669,s5670,TV Show,Heaven's Garden,Unknown,"Bul-am Choi, Ho-Jeong Yoo, Sae-ron Kim, Chan-hee Kang, Woo-Sung Hyun, An Seo Hyun, Ho-Jin Kim",South Korea,2016-12-15,2011,TV-MA,1 Season,"International TV Shows, Korean TV Shows, TV Dramas","When her husband goes to jail for bankruptcy, a woman takes her two daughters to live with her father, who severed ties with her years ago.",2016,12
5670,s5671,TV Show,Ice Fantasy,Unknown,"Feng Shaofeng, Victoria Song, Ma Tianyu, Zhang Meng, Hee-seon Kim, Gong Beibi, Shao Bing, Hu Bing, Wang Duo",China,2016-12-15,2016,TV-14,1 Season,"International TV Shows, TV Action & Adventure, TV Sci-Fi & Fantasy","The Ice Tribe prince journeys to a sacred mountain to vanquish evil but soon finds himself at war with the Fire Tribe, led by his long-lost brother.",2016,12
5671,s5672,TV Show,Immortal Classic,Unknown,"Jae-suk Han, Sun-Young Park, Du-shim Ko, Ye-jin Lim, Jong-hwan Choi, Ha-Nui Lee, Yun-Hoo Ko, Byeong-Ki Kim, Sun-kyung Kim, Yoon-Sik Baek",South Korea,2016-12-15,2012,TV-14,1 Season,"International TV Shows, Korean TV Shows, TV Dramas","Two renowned culinary families led by legendary food icons battle for the position of greatest chef, while protecting their secret kimchee recipes.",2016,12
5672,s5673,TV Show,InuYasha,Unknown,"Kappei Yamaguchi, Satsuki Yukino, Kumiko Watanabe, Noriko Hidaka, Koji Tsujitani, Houko Kuwashima, Toshiyuki Morikawa, Richard Ian Cox, Moneca Stori, Paul Dobson, Kirby Morrow, Kelly Sheridan, Jillian Michaels",Japan,2016-12-15,2001,TV-14,2 Seasons,"Anime Series, International TV Shows","Yanked down a well, schoolgirl Kagome Higurashi emerges in feudal Japan, where she must reassemble a sacred jewel while eluding half-demon Inuyasha.",2016,12
5673,s5674,TV Show,K-POP Extreme Survival,Unknown,"Jung Eun Kim, Yu-hwan Park, Eun-ah Go, Yong Hwan Kwak, Jin Hyuk",South Korea,2016-12-15,2012,TV-14,1 Season,"International TV Shows, Korean TV Shows, Romantic TV Shows",Seung Yeon decides to chase her dream of becoming a K-pop star and audition for a popular group. There's only one catch: It's a boy band.,2016,12
5675,s5676,TV Show,Miss Panda & Mr. Hedgehog,Unknown,"Dong-hae Lee, Seung-ah Yoon, Jin-hyuk Choi, So-young Yoo, Yeo-jin Hong, Min-jin Jung",South Korea,2016-12-15,2012,TV-PG,1 Season,"International TV Shows, Korean TV Shows, Romantic TV Shows","When a gifted patissier with a gloomy past meets a bright and easygoing café owner, he begins to shed his thorns and learns to love again.",2016,12
5677,s5678,TV Show,Tokyo Trial,Unknown,"Marcel Hensema, Paul Freeman, Irrfan Khan, Stacy Keach, Michael Ironside, Stephen McHattie, Shinya Tsukamoto","Canada, Japan, Netherlands",2016-12-13,2017,TV-MA,1 Season,"International TV Shows, TV Dramas","In the wake of World War II, 11 Allied judges are tasked with weighing the fates of Japanese war criminals in a tense international trial.",2016,12
5683,s5684,TV Show,White Rabbit Project,Unknown,"Tory Belleci, Kari Byron, Grant Imahara",United States,2016-12-09,2016,TV-14,1 Season,"Docuseries, International TV Shows, Reality TV","Kari Byron, Tory Belleci and Grant Imahara rank history's greatest inventions, heists and more in this series from the producers of ""MythBusters.""",2016,12
5684,s5685,TV Show,Miss in Kiss,Unknown,"Esther Wu, Dino Lee, Gong Yi Teng, Xi Wei Lun, Honduras, Vega Tsai, Shen Chang Hung",Taiwan,2016-12-08,2016,TV-14,1 Season,"International TV Shows, Romantic TV Shows, TV Comedies","A quirk of fate sends an ordinary, sweet-natured high school girl and her father into the home of the school genius, on whom she has a huge crush.",2016,12
5690,s5691,TV Show,From Dusk Till Dawn,Unknown,"D.J. Cotrona, Zane Holtz, Eiza Gonzalez, Jesse Garcia, Madison Davenport, Brandon Soo Hoo, Wilmer Valderrama, Robert Patrick, Jake Busey, Samantha Esteban, Don Johnson",United States,2016-12-05,2016,TV-MA,3 Seasons,"Classic & Cult TV, TV Action & Adventure, TV Horror",Bank-robbing brothers encounter vengeful lawmen and demons south of the border in this original series based on Robert Rodriguez' cult horror film.,2016,12
